{
  "meta": {
    "module": "src.guidance.core.metadata",
    "source": "src/guidance/core/metadata.zig",
    "language": "zig"
  },
  "comment": " core/metadata.zig — Unified GuidanceDoc JSON metadata loading.\n\n Consolidates:\n   - query_engine.zig:loadPublicMemberNames()\n   - query_engine.zig:loadUsedByFromJson()\n   - query_engine.zig:loadSkillsFromJson()\n   - staged.zig:buildMetadataStage()\n   - staged.zig:loadSkillNamesFromJson()\n\n All returned strings are allocator-owned; callers must free.",
  "used_by": ["src/guidance/core/format.zig", "src/guidance/main.zig", "src/guidance/staged.zig"],
  "members": [
    {
      "type": "fn_decl",
      "name": "loadSkillsFromJson",
      "match_hash": "8fd90db5a35ddc10b967e96d6b21bbc58afb33d51b468e6729dc94230afb2171",
      "signature": "fn loadSkillsFromJson(allocator: std.mem.Allocator, json_path: []const u8) -> ?[]const u8",
      "returns": "?[]const u8",
      "is_pub": true,
      "line": 19
    },
    {
      "type": "fn_decl",
      "name": "loadSkillNamesFromJson",
      "match_hash": "7262a13d08b1feff7f47947f0186e101515d93b4a7f910e2a9de20dfab3cca26",
      "signature": "fn loadSkillNamesFromJson(allocator: std.mem.Allocator, json_path: []const u8) -> [][]const u8",
      "returns": "[][]const u8",
      "is_pub": true,
      "line": 52
    },
    {
      "type": "fn_decl",
      "name": "loadUsedByFromJson",
      "match_hash": "8af930b8f0cb0595974092c74fae5dfdfb400adff691346148fa38c33815de1a",
      "signature": "fn loadUsedByFromJson(allocator: std.mem.Allocator, json_path: []const u8) -> ?[][]const u8",
      "returns": "?[][]const u8",
      "is_pub": true,
      "line": 87
    },
    {
      "type": "fn_decl",
      "name": "loadPublicMemberNames",
      "match_hash": "6ae4d8084808fffdbf0e6d64f06b46ec4f74b685999fee944a774c27aad0dea5",
      "signature": "fn loadPublicMemberNames(allocator: std.mem.Allocator, json_path: []const u8) -> ?[][]const u8",
      "returns": "?[][]const u8",
      "is_pub": true,
      "line": 109
    },
    {
      "type": "fn_decl",
      "name": "buildMetadataStage",
      "match_hash": "d6967a25d787d8185f96e33d8d18d35d4ebe68164c7ac8ec6db5a0cb00317744",
      "signature": "fn buildMetadataStage(allocator: std.mem.Allocator, json_path: []const u8, source: []const u8) -> ?types_mod.Stage",
      "returns": "?types_mod.Stage",
      "is_pub": true,
      "line": 143
    }
  ]
}
