{
  "meta": {
    "module": "src.guidance.sync.json_writer",
    "source": "src/guidance/sync/json_writer.zig",
    "language": "zig"
  },
  "comment": " sync/json_writer.zig — JSON serialization for guidance documents.\n\n Moved from types.zig to keep type definitions separate from serialization logic.",
  "used_by": ["src/guidance/sync/json_store.zig", "src/guidance/types.zig"],
  "members": [
    {
      "type": "fn_private",
      "name": "writeEscaped",
      "match_hash": "13ae1b62f368d7ab863ea922c74eab7826fb13065df19e5f0321c3d7cc3f5aec",
      "signature": "fn writeEscaped(writer, value: []const u8) -> void",
      "returns": "void",
      "is_pub": false,
      "line": 12
    },
    {
      "type": "fn_private",
      "name": "writeStrField",
      "match_hash": "0d28cd1897be4a05dfcef73b98fd4cd8f0013e883c5a084d49b5c56cc41d254a",
      "signature": "fn writeStrField(writer, key: []const u8, value: []const u8) -> void",
      "returns": "void",
      "is_pub": false,
      "line": 17
    },
    {
      "type": "fn_private",
      "name": "writeSep",
      "match_hash": "91c92042c18105bfe9867037eda424cd8e1c72410f1155622465555da403ed14",
      "signature": "fn writeSep(writer, need: *bool) -> void",
      "returns": "void",
      "is_pub": false,
      "line": 25
    },
    {
      "type": "fn_private",
      "name": "writeStringArray",
      "match_hash": "6c398a3f369aeaf4f186fc56c3a7e4398120fb1efa344404e3c897c73bf451bf",
      "signature": "fn writeStringArray(writer, key: []const u8, items: []const []const u8) -> void",
      "returns": "void",
      "is_pub": false,
      "line": 31
    },
    {
      "type": "fn_private",
      "name": "writeMember",
      "match_hash": "edb6188bd24ff95565d7333212aca279cec0bea12c4f2c67fd880cdee6a7fdfd",
      "signature": "fn writeMember(writer, member: types.Member, indent: []const u8) -> void",
      "returns": "void",
      "is_pub": false,
      "line": 49
    },
    {
      "type": "fn_decl",
      "name": "jsonifyMember",
      "match_hash": "cb6525b92503dbf4ae1bf039f36e9d3933f40777a6ae702854440647a5a324b9",
      "signature": "fn jsonifyMember(allocator: std.mem.Allocator, member: types.Member) -> ?[]u8",
      "returns": "?[]u8",
      "is_pub": true,
      "line": 136
    },
    {
      "type": "fn_decl",
      "name": "jsonifyGuidanceDoc",
      "match_hash": "0c2534aa51c204da24de822d25e1a6b6ce3ac3c2d8de32c0af90b411794d1a5a",
      "signature": "fn jsonifyGuidanceDoc(allocator: std.mem.Allocator, doc: types.GuidanceDoc) -> []u8",
      "returns": "[]u8",
      "is_pub": true,
      "line": 144
    }
  ]
}
