{
  "meta": {
    "module": "src.common.shared_string",
    "source": "src/common/shared_string.zig",
    "language": "zig"
  },
  "skills": [
    { "ref": "skills/gof-patterns/SKILL.md", "context": "GoF patterns detected" }
  ],
  "used_by": ["src/common/root.zig"],
  "members": [
    {
      "type": "struct",
      "name": "SharedString",
      "match_hash": "938045179c1f0a6a4c1549b43c5260dc89f7e9b081ff4242d26bcca92c7c58ce",
      "signature": "keyword_struct SharedString { ... }",
      "patterns": [
        { "name": "Factory (GoF)", "type": "GoF", "ref": "guidance/skills/gof-patterns/SKILL.md#factory" }
      ],
      "is_pub": true,
      "members": [
        {
          "type": "fn_private",
          "name": "create",
          "match_hash": "c00515af304a424b6f56823640a630054ddf5ea67c0b7b0ced5103d231dcc0c6",
          "signature": "fn create(allocator: std.mem.Allocator, str: []const u8) -> *SharedString",
          "params": [
            { "name": "allocator", "type": "std.mem.Allocator" },
            { "name": "str", "type": "[]const u8" }
          ],
          "returns": "*SharedString",
          "patterns": [
            { "name": "Factory (GoF)", "type": "GoF", "ref": "guidance/skills/gof-patterns/SKILL.md#factory" }
          ],
          "is_pub": false,
          "line": 29
        }
    ,    {
          "type": "fn_private",
          "name": "destroy",
          "match_hash": "28cc59f0a867f4679f2dd2d484244abe24da20e84802b817d48b7f1b8cbaf624",
          "signature": "fn destroy(self: *SharedString, allocator: std.mem.Allocator) -> void",
          "params": [
            { "name": "self", "type": "*SharedString" },
            { "name": "allocator", "type": "std.mem.Allocator" }
          ],
          "returns": "void",
          "is_pub": false,
          "line": 37
        }
    ,    {
          "type": "fn_private",
          "name": "acquire",
          "match_hash": "59ec5e5e58be68273586f7b6cb80e5d31584712d02b10991decadfe013fc4eb9",
          "signature": "fn acquire(self: *SharedString) -> void",
          "params": [
            { "name": "self", "type": "*SharedString" }
          ],
          "returns": "void",
          "is_pub": false,
          "line": 46
        }
    ,    {
          "type": "fn_private",
          "name": "release",
          "match_hash": "b8574a1df9fc862e08294aa34fe1331a4874b7b015b0dbf0fb4a4f2d2c548d46",
          "signature": "fn release(self: *SharedString, allocator: std.mem.Allocator) -> void",
          "params": [
            { "name": "self", "type": "*SharedString" },
            { "name": "allocator", "type": "std.mem.Allocator" }
          ],
          "returns": "void",
          "is_pub": false,
          "line": 52
        }
    ,    {
          "type": "fn_decl",
          "name": "slice",
          "match_hash": "036808f946c2ef8da9f89b3b39130cffa2b8aa7f7de63e26a0bf47d595552177",
          "signature": "fn slice(self: *const SharedString) -> []const u8",
          "params": [
            { "name": "self", "type": "*const SharedString" }
          ],
          "returns": "[]const u8",
          "is_pub": true,
          "line": 67
        }
      ],
      "line": 21
    },
    {
      "type": "test_decl",
      "name": "SharedString: basic create and read",
      "is_pub": false,
      "line": 117
    },
    {
      "type": "test_decl",
      "name": "SharedString: empty string",
      "is_pub": false,
      "line": 129
    },
    {
      "type": "test_decl",
      "name": "SharedString: clone shares allocation, both deinit safely",
      "is_pub": false,
      "line": 141
    },
    {
      "type": "test_decl",
      "name": "SharedString: ref_count reaches zero exactly once",
      "is_pub": false,
      "line": 161
    },
    {
      "type": "test_decl",
      "name": "SharedString: slice pointer stability across clones",
      "is_pub": false,
      "line": 178
    }
  ]
}
