{
  "meta": {
    "module": "src.guidance.agents_md",
    "source": "src/guidance/agents_md.zig",
    "language": "zig"
  },
  "comment": " AGENTS.md content generator for guidance init.",
  "used_by": ["src/guidance/sync_engine.zig"],
  "members": [
    {
      "type": "fn_decl",
      "name": "generateAgentsMdContent",
      "match_hash": "8d7465fc339e7fac9eeed95e9bce26b42bc7bd23a1a57757957433a876e8a792",
      "signature": "fn generateAgentsMdContent(allocator: std.mem.Allocator, guidance_dir: []const u8) -> []const u8",
      "returns": "[]const u8",
      "is_pub": true,
      "line": 19
    }
  ]
}
