{
  "meta": {
    "module": "src.common.logging",
    "source": "src/common/logging.zig",
    "language": "zig"
  },
  "comment": " logging.zig — Structured logging context and timing scope for Fluent WEAVER.\n\n Request-scoped structured logging with timing and correlation.\n For global log configuration and output, see common.log.Logger.\n\n ## Design\n\n `LogContext` is a thread-local struct that propagates request-scoped metadata\n (request_id, user_id, trace_id, span_id) through a call chain without threading\n the context through every function signature.\n\n `Scope` wraps a named operation: it logs start (with context) and end (with\n duration) via `std.log.debug`. When context is null, no logging occurs — zero\n overhead in production with filters set above `debug`.\n\n `callLogged` wraps a single function call in a Scope:\n\n   const result = try callLogged(\"embed\", embedder.embed, .{ allocator, text });\n\n For manual scope management:\n\n   const scope = Scope.begin(\"embed\");\n   defer scope.end();\n   const result = try embedder.embed(allocator, text);\n\n ## Thread Safety\n\n `LogContext.current` is `threadlocal` — each OS thread has its own copy.\n No synchronization required. Set context at the entry point of a request\n handler and clear it on exit:\n\n   LogContext.set(.{ .request_id = \"req-123\" });\n   defer LogContext.clear();\n\n Context does NOT propagate across thread boundaries automatically. When\n spawning a worker thread, pass the context value explicitly and call\n `LogContext.set()` on the new thread.",
  "used_by": ["src/common/logging_tests.zig", "src/common/root.zig"],
  "members": [
    {
      "type": "struct",
      "name": "LogContext",
      "match_hash": "76979da75c2c56ddd63b863dfbf9b4b5eece6def364ed7ee9c3b31e23e1d373b",
      "signature": "keyword_struct LogContext { ... }",
      "is_pub": true,
      "members": [
        {
          "type": "fn_decl",
          "name": "set",
          "match_hash": "ca4c6ad19b58699e531c8324743f8919f77dd8cde8004a966771d7bb624378f0",
          "signature": "fn set(ctx: LogContext) -> void",
          "returns": "void",
          "is_pub": true,
          "line": 53
        },
        {
          "type": "fn_decl",
          "name": "get",
          "match_hash": "4e3caaf23d8d41f59eb019094623a0d9c14938fbf291c476d38d91892f2c70ec",
          "signature": "fn get() -> ?LogContext",
          "returns": "?LogContext",
          "is_pub": true,
          "line": 58
        },
        {
          "type": "fn_decl",
          "name": "clear",
          "match_hash": "b541dcbfd2ce5952b6c7dc4ee590aa95d5b99681eeb5b775f6cf18b9c636e973",
          "signature": "fn clear() -> void",
          "returns": "void",
          "is_pub": true,
          "line": 63
        },
        {
          "type": "fn_decl",
          "name": "format",
          "match_hash": "99157a9a63c9b74923895a3894e6361e612e16568f2e02263b6fa033e8eb7e8d",
          "signature": "fn format(self: LogContext, writer) -> void",
          "returns": "void",
          "is_pub": true,
          "line": 70
        }
      ],
      "line": 43
    },
    {
      "type": "struct",
      "name": "Scope",
      "match_hash": "53652d04e14f56d304e62fa4fc0b92310ff0875555ac9413e952bb197c7ead0b",
      "signature": "keyword_struct Scope { ... }",
      "is_pub": true,
      "members": [
        {
          "type": "fn_private",
          "name": "nanoNow",
          "match_hash": "730fe13bfade84e9d9d03853d9d141d4afe3ec3c48ffd45dc023756102d98610",
          "signature": "fn nanoNow() -> i96",
          "returns": "i96",
          "is_pub": false,
          "line": 103
        },
        {
          "type": "fn_decl",
          "name": "begin",
          "match_hash": "eea8ae942419dbb0869235213fa587a9a29b938e75ac5b631b5adce956f00e32",
          "signature": "fn begin(name: []const u8) -> Scope",
          "returns": "Scope",
          "is_pub": true,
          "line": 108
        },
        {
          "type": "fn_decl",
          "name": "end",
          "match_hash": "295379aeb01da5c14e762dbda7ac6e98df767ef9e23282e0ed5161ae30700435",
          "signature": "fn end(self: Scope) -> void",
          "returns": "void",
          "is_pub": true,
          "line": 122
        }
      ],
      "line": 98
    },
    {
      "type": "fn_decl",
      "name": "callLogged",
      "match_hash": "6d109548378e8488dc1d14afdf53a3246a233d4b7a3f3109aecb87baad74f985",
      "signature": "fn callLogged(name: []const u8, func, args) -> @typeInfo(@TypeOf(func)).@\"fn\".return_type.?",
      "returns": "@typeInfo(@TypeOf(func)).@\"fn\".return_type.?",
      "is_pub": true,
      "line": 137
    },
    {
      "type": "test_decl",
      "name": "LogContext: set and get",
      "is_pub": false,
      "line": 151
    },
    {
      "type": "test_decl",
      "name": "LogContext: clear removes context",
      "is_pub": false,
      "line": 161
    },
    {
      "type": "test_decl",
      "name": "LogContext: null by default (fresh thread)",
      "is_pub": false,
      "line": 167
    },
    {
      "type": "test_decl",
      "name": "LogContext: format with all fields",
      "is_pub": false,
      "line": 174
    },
    {
      "type": "test_decl",
      "name": "LogContext: format with partial fields",
      "is_pub": false,
      "line": 189
    },
    {
      "type": "test_decl",
      "name": "LogContext: format with no fields",
      "is_pub": false,
      "line": 197
    },
    {
      "type": "test_decl",
      "name": "callLogged: wraps plain function",
      "is_pub": false,
      "line": 204
    },
    {
      "type": "test_decl",
      "name": "callLogged: wraps error-returning function",
      "is_pub": false,
      "line": 218
    },
    {
      "type": "test_decl",
      "name": "LogContext: GPA no leaks",
      "is_pub": false,
      "line": 236
    }
  ]
}
