{
  "meta": {
    "module": "src.guidance.health.test_audit",
    "source": "src/guidance/health/test_audit.zig",
    "language": "zig"
  },
  "comment": " test_audit.zig — Phase 2: Test file convention enforcement.\n\n Validates that:\n   1. Files named `*_tests.zig` contain only test declarations (no pub fn, struct, etc.)\n   2. Test files discovered in the workspace are covered by at least one build.zig target.\n\n A \"non-test declaration\" in a *_tests.zig file is any top-level declaration that is\n not a `test` block. The check is AST-based for accuracy.",
  "used_by": ["src/guidance/health/health.zig"],
  "members": [
    {
      "type": "struct",
      "name": "TestAnomaly",
      "match_hash": "93c2546f50b0466194a2764fec178518f6c966fff9d6ca769cc371fee946f38f",
      "signature": "keyword_struct TestAnomaly { ... }",
      "is_pub": true,
      "line": 23
    },
    {
      "type": "fn_decl",
      "name": "hasNonTestDecl",
      "match_hash": "fc1f8125ddf112280259cffad43f49b9327bb27f4f3b419be4f7260089df77ad",
      "signature": "fn hasNonTestDecl(allocator: std.mem.Allocator, source: [:0]const u8, out_name: *?[]const u8, out_line: *?u32) -> bool",
      "params": [
        { "name": "allocator", "type": "std.mem.Allocator" },
        { "name": "source", "type": "[:0]const u8" },
        { "name": "out_name", "type": "*?[]const u8" },
        { "name": "out_line", "type": "*?u32" }
      ],
      "returns": "bool",
      "is_pub": true,
      "line": 44
    },
    {
      "type": "fn_private",
      "name": "nameOfDecl",
      "match_hash": "7e3eb14ad43ce6157002a3c3acd688386caca2f45142953f64fc119488a90708",
      "signature": "fn nameOfDecl(tree: *const std.zig.Ast, decl: std.zig.Ast.Node.Index) -> ?[]const u8",
      "params": [
        { "name": "tree", "type": "*const std.zig.Ast" },
        { "name": "decl", "type": "std.zig.Ast.Node.Index" }
      ],
      "returns": "?[]const u8",
      "is_pub": false,
      "line": 124
    },
    {
      "type": "fn_private",
      "name": "lineOfDecl",
      "match_hash": "085e7b4e3fbd13535d2596b2c99836d22d14f6151f282c850124df97c6fccd68",
      "signature": "fn lineOfDecl(tree: *const std.zig.Ast, decl: std.zig.Ast.Node.Index) -> ?u32",
      "params": [
        { "name": "tree", "type": "*const std.zig.Ast" },
        { "name": "decl", "type": "std.zig.Ast.Node.Index" }
      ],
      "returns": "?u32",
      "is_pub": false,
      "line": 143
    },
    {
      "type": "fn_decl",
      "name": "auditTestFiles",
      "match_hash": "042ff7acd0f1e2bf1f4df8d7c53e864dc599f43b85726b7a6fc7afac8e16fa92",
      "signature": "fn auditTestFiles(allocator: std.mem.Allocator, workspace: []const u8) -> []TestAnomaly",
      "params": [
        { "name": "allocator", "type": "std.mem.Allocator" },
        { "name": "workspace", "type": "[]const u8" }
      ],
      "returns": "[]TestAnomaly",
      "is_pub": true,
      "line": 155
    },
    {
      "type": "fn_decl",
      "name": "writeAiOutput",
      "match_hash": "a325c7ad055b8a3392d708faf6b6af096a113c551cd1b6b7af0f7cd8157af367",
      "signature": "fn writeAiOutput(w: *std.Io.Writer, anomalies: []const TestAnomaly) -> void",
      "params": [
        { "name": "w", "type": "*std.Io.Writer" },
        { "name": "anomalies", "type": "[]const TestAnomaly" }
      ],
      "returns": "void",
      "is_pub": true,
      "line": 285
    },
    {
      "type": "fn_decl",
      "name": "writeHumanOutput",
      "match_hash": "4a670c6631f3a1b44ddccd0f4b30e52765b4746f9226f4d310bb2a0b1ba9ea50",
      "signature": "fn writeHumanOutput(w: *std.Io.Writer, anomalies: []const TestAnomaly) -> void",
      "params": [
        { "name": "w", "type": "*std.Io.Writer" },
        { "name": "anomalies", "type": "[]const TestAnomaly" }
      ],
      "returns": "void",
      "is_pub": true,
      "line": 313
    },
    {
      "type": "fn_decl",
      "name": "writeJsonFragment",
      "match_hash": "f5b1ad311986b1f2c5ab929f5a4e986e5cd81937b0e8eb6d42c96878bfd29deb",
      "signature": "fn writeJsonFragment(w: *std.Io.Writer, anomalies: []const TestAnomaly) -> void",
      "params": [
        { "name": "w", "type": "*std.Io.Writer" },
        { "name": "anomalies", "type": "[]const TestAnomaly" }
      ],
      "returns": "void",
      "is_pub": true,
      "line": 325
    }
  ]
}
