{
  "meta": {
    "module": "src.guidance.plugin_registry",
    "source": "src/guidance/plugin_registry.zig",
    "language": "zig"
  },
  "comment": " PluginRegistry — maps file extensions to LanguagePlugin descriptors.\n\n The registry is populated at startup with built-in plugins.  External\n providers (Python, Rust, …) can be registered at runtime via the config.\n\n Usage:\n   var reg = PluginRegistry.init(allocator);\n   defer reg.deinit();\n   if (reg.getForExtension(\".zig\")) |p| { ... }",
  "used_by": ["src/guidance/plugin_registry_tests.zig", "src/guidance/query_engine.zig"],
  "members": [
    {
      "type": "struct",
      "name": "PluginRegistry",
      "match_hash": "01beada2d510f1522a16d3e8be911980e70f55ac88e3b760c75f57f760e0d462",
      "signature": "keyword_struct PluginRegistry { ... }",
      "is_pub": true,
      "members": [
        {
          "type": "fn_decl",
          "name": "init",
          "match_hash": "10089975963808a6bc41ef5928eb306107a473d03d0413cbf2f0574b21dc8661",
          "signature": "fn init(allocator: std.mem.Allocator) -> Self",
          "returns": "Self",
          "is_pub": true,
          "line": 30
        },
        {
          "type": "fn_decl",
          "name": "deinit",
          "match_hash": "be92814edf1a681576bb29a7d2e90d22d27597bd53a72a0fe1a49ee774e80b33",
          "signature": "fn deinit(self: *Self) -> void",
          "returns": "void",
          "is_pub": true,
          "line": 51
        },
        {
          "type": "fn_decl",
          "name": "register",
          "match_hash": "ede451492bb7799ba0fc475bb7d23f6aa37e8d48993d2c6e1017eb9d09ff51dd",
          "signature": "fn register(self: *Self, allocator: std.mem.Allocator, p: LanguagePlugin) -> void",
          "returns": "void",
          "is_pub": true,
          "line": 58
        },
        {
          "type": "fn_decl",
          "name": "getForExtension",
          "match_hash": "260893a3da6ab81b1ac911ab4e83656b5daeddab423f70f787868da56965c6cc",
          "signature": "fn getForExtension(self: *const Self, ext: []const u8) -> ?*const LanguagePlugin",
          "returns": "?*const LanguagePlugin",
          "is_pub": true,
          "line": 68
        },
        {
          "type": "fn_decl",
          "name": "getForPath",
          "match_hash": "2c6468f9fe37835dee1a6c7221ecf39f2eb71b1c54709561571a5f0f84df69d5",
          "signature": "fn getForPath(self: *const Self, path: []const u8) -> ?*const LanguagePlugin",
          "returns": "?*const LanguagePlugin",
          "is_pub": true,
          "line": 74
        },
        {
          "type": "fn_decl",
          "name": "registeredLanguages",
          "match_hash": "d6031448ab57c660b5cc7c3282895abcbda2378d08188d2d4c4d52ff1cea7276",
          "signature": "fn registeredLanguages(self: *const Self, allocator: std.mem.Allocator) -> []const []const u8",
          "returns": "[]const []const u8",
          "is_pub": true,
          "line": 82
        }
      ],
      "line": 19
    }
  ]
}
