{
  "meta": {
    "module": "src.subagent.reflect",
    "source": "src/subagent/reflect.zig",
    "language": "zig"
  },
  "comment": "[domain-patterns]  reflect.zig — Scratchpad management for the subagent FSM.\n\n Implements a ring-buffer scratchpad that accumulates observations and\n reasoning from prior iterations. Provides O(1) append and eviction,\n sentence-boundary truncation for observations, and token estimation\n for context budgeting.",
  "skills": [
    { "ref": "skills/domain-patterns/SKILL.md", "context": "Domain patterns detected" }
  ],
  "used_by": ["src/subagent/fsm.zig", "src/subagent/root.zig"],
  "members": [
    {
      "type": "struct",
      "name": "Scratchpad",
      "match_hash": "286d86a6dde059ce094f7f4d84a4cc3dd5dd1324d58d452b28fe6b50c7de10d0",
      "signature": "keyword_struct Scratchpad { ... }",
      "patterns": [
        { "name": "Ring Buffer", "type": "Domain", "ref": "guidance/skills/domain_patterns/SKILL.md#ring-buffer" }
      ],
      "is_pub": true,
      "members": [
        {
          "type": "fn_decl",
          "name": "init",
          "match_hash": "3e6b2b2f340bcb21512b3ffa90e9a000f83d484a4348b1b40c71fe4df3d2aecd",
          "signature": "fn init(allocator: std.mem.Allocator, max_entries: u16) -> Scratchpad",
          "returns": "Scratchpad",
          "is_pub": true,
          "line": 19
        },
        {
          "type": "fn_decl",
          "name": "deinit",
          "match_hash": "ea42f3b1f2f2882187d733c9a502f46a76cbcf50777462d2fe411846ad5d8bc1",
          "signature": "fn deinit(self: *Scratchpad) -> void",
          "returns": "void",
          "is_pub": true,
          "line": 27
        },
        {
          "type": "fn_decl",
          "name": "append",
          "match_hash": "d8fcc20a946b9418e2ea9b22f37439ae6ce1dc4c8a3909c949be6ab4b8d9c0c9",
          "signature": "fn append(self: *Scratchpad, entry: types.ScratchpadEntry) -> void",
          "returns": "void",
          "is_pub": true,
          "line": 34
        },
        {
          "type": "fn_decl",
          "name": "entries",
          "match_hash": "27767ef465202a9262e128115109de8126dc13e101a919cffb1783e8611f497f",
          "signature": "fn entries(self: *const Scratchpad) -> []const types.ScratchpadEntry",
          "returns": "[]const types.ScratchpadEntry",
          "is_pub": true,
          "line": 46
        },
        {
          "type": "fn_decl",
          "name": "formatContext",
          "match_hash": "5b86d7655a2a1fb1803e2d9f420b7556966766276e615b6fb5b5154027e83bd1",
          "signature": "fn formatContext(self: *Scratchpad, allocator: std.mem.Allocator) -> []const u8",
          "returns": "[]const u8",
          "is_pub": true,
          "line": 50
        },
        {
          "type": "fn_private",
          "name": "dupEntry",
          "match_hash": "915a3e81bd5dcd2c2632d062744aacdbe0e6512dc68f0c9a1311f5da5a6ebb0f",
          "signature": "fn dupEntry(self: *const Scratchpad, entry: types.ScratchpadEntry) -> types.ScratchpadEntry",
          "returns": "types.ScratchpadEntry",
          "is_pub": false,
          "line": 72
        },
        {
          "type": "fn_private",
          "name": "freeEntry",
          "match_hash": "a785476390a3517920d26826d6c5eabc81960b2d24f2a5ae4444bd2ae3c091c4",
          "signature": "fn freeEntry(self: *Scratchpad, entry: types.ScratchpadEntry) -> void",
          "returns": "void",
          "is_pub": false,
          "line": 83
        }
      ],
      "line": 12
    },
    {
      "type": "fn_decl",
      "name": "appendObservation",
      "match_hash": "2263f56f7db1e811b006ef4e28c580df03dbbcf75c7fe38246fd845959d7dfc2",
      "signature": "fn appendObservation(allocator: std.mem.Allocator, scratchpad: *Scratchpad, iteration: u16, item_text: []const u8, action: types.ActionType, raw_output: []const u8, success: bool) -> void",
      "returns": "void",
      "is_pub": true,
      "line": 90
    }
  ]
}
