{
  "meta": {
    "module": "src.guidance.skeleton",
    "source": "src/guidance/skeleton.zig",
    "language": "zig"
  },
  "comment": " skeleton.zig — File and struct skeleton extraction for token-efficient discovery.\n\n Implements the \"File Skeleton\" pattern from VISION.md:\n - TIER 2: `guidance explain \"filename.zig\"` → show signatures + comments only\n - TIER 3: `guidance explain \"StructName\"` → show struct members only\n\n Private members are omitted from skeleton views to reduce noise and token usage.",
  "used_by": ["src/guidance/query_engine.zig"],
  "members": [
    {
      "type": "fn_decl",
      "name": "freeTierMatch",
      "match_hash": "4f4729e5407df137845f81e56055e8e7197db5bf353e76043f84a999f6d0b2d6",
      "signature": "fn freeTierMatch(allocator: std.mem.Allocator, tier_match: TierMatch) -> void",
      "returns": "void",
      "is_pub": true,
      "line": 34
    },
    {
      "type": "fn_decl",
      "name": "classifyQuery",
      "match_hash": "f323cac8dd113b5c499d00a753965b109d69cc66b485e3b65f3f67e2053e7bce",
      "signature": "fn classifyQuery(allocator: std.mem.Allocator, query: []const u8, capabilities_dir: []const u8, workspace: []const u8, guidance_dir: []const u8) -> TierMatch",
      "returns": "TierMatch",
      "is_pub": true,
      "line": 50
    },
    {
      "type": "fn_private",
      "name": "isCapabilityName",
      "match_hash": "6f5b59c69ba468e11b3a5808c24892114435846bc1b6b8c116982ef42de49c45",
      "signature": "fn isCapabilityName(allocator: std.mem.Allocator, query: []const u8, capabilities_dir: []const u8) -> error{OutOfMemory}!?[]const u8",
      "returns": "error{OutOfMemory}!?[]const u8",
      "is_pub": false,
      "line": 80
    },
    {
      "type": "fn_private",
      "name": "normalizeCapabilityName",
      "match_hash": "57eeb1ef049dd897522e86c0a966df4b23b1971bbf371abc17e8a12caf36b313",
      "signature": "fn normalizeCapabilityName(allocator: std.mem.Allocator, input: []const u8) -> error{OutOfMemory}![]const u8",
      "returns": "error{OutOfMemory}![]const u8",
      "is_pub": false,
      "line": 98
    },
    {
      "type": "fn_private",
      "name": "resolveFilePath",
      "match_hash": "60d70a920a317071518466866477477f3c8e2334cc66664a33be62d230d526cf",
      "signature": "fn resolveFilePath(allocator: std.mem.Allocator, query: []const u8, workspace: []const u8, guidance_dir: []const u8) -> error{OutOfMemory}!?TierMatch",
      "returns": "error{OutOfMemory}!?TierMatch",
      "is_pub": false,
      "line": 124
    },
    {
      "type": "fn_private",
      "name": "findFilesByBasename",
      "match_hash": "e3725d1983c14de3bfec80de5355c8cb6a6a6edea41b0116853a37cdd451600b",
      "signature": "fn findFilesByBasename(allocator: std.mem.Allocator, basename: []const u8, guidance_dir: []const u8) -> error{OutOfMemory}!?[]const []const u8",
      "returns": "error{OutOfMemory}!?[]const []const u8",
      "is_pub": false,
      "line": 164
    },
    {
      "type": "fn_private",
      "name": "checkFileExists",
      "match_hash": "f0522a153dc149078cad1f6630a43d999be295841443d71b80cfabb3053bcd6c",
      "signature": "fn checkFileExists(allocator: std.mem.Allocator, rel_path: []const u8, workspace: []const u8, guidance_dir: []const u8) -> error{OutOfMemory}!?[]const u8",
      "returns": "error{OutOfMemory}!?[]const u8",
      "is_pub": false,
      "line": 213
    },
    {
      "type": "fn_private",
      "name": "srcToGuidanceJson",
      "match_hash": "ba9c947c599fce6ef9a34e72339c298d00ac37ceb7697ecb5e14da7cfa17baf5",
      "signature": "fn srcToGuidanceJson(allocator: std.mem.Allocator, src_path: []const u8, guidance_dir: []const u8) -> error{OutOfMemory}![]const u8",
      "returns": "error{OutOfMemory}![]const u8",
      "is_pub": false,
      "line": 233
    },
    {
      "type": "fn_private",
      "name": "jsonPathToSrcPath",
      "match_hash": "f520a995f5cd11ef4a1228475f5c02490ffadf3351b5873695a4e62e32f09b44",
      "signature": "fn jsonPathToSrcPath(allocator: std.mem.Allocator, json_path: []const u8) -> ?[]const u8",
      "returns": "?[]const u8",
      "is_pub": false,
      "line": 244
    },
    {
      "type": "fn_private",
      "name": "isStructNameMatch",
      "match_hash": "6c43abf131e7b893a8e4dbe6bb819d4d279e648a3b69d1d4f2b573125acbc81e",
      "signature": "fn isStructNameMatch(allocator: std.mem.Allocator, query: []const u8, guidance_dir: []const u8) -> error{OutOfMemory}!?[]const u8",
      "returns": "error{OutOfMemory}!?[]const u8",
      "is_pub": false,
      "line": 254
    },
    {
      "type": "fn_private",
      "name": "findStructNameInJson",
      "match_hash": "388fb1c570b23398e344efe3b6248483db52f36bb1b8a50a3e1cdf8f0c79008b",
      "signature": "fn findStructNameInJson(allocator: std.mem.Allocator, query: []const u8, json_dir: []const u8, rel_path: []const u8) -> error{OutOfMemory}!?[]const u8",
      "returns": "error{OutOfMemory}!?[]const u8",
      "is_pub": false,
      "line": 285
    },
    {
      "type": "fn_private",
      "name": "looksLikeIdentifier",
      "match_hash": "135faa954ee592baafd157a29b4b80163c2964aa8ec8c847cd18d2124e83ca84",
      "signature": "fn looksLikeIdentifier(query: []const u8) -> bool",
      "returns": "bool",
      "is_pub": false,
      "line": 326
    },
    {
      "type": "fn_decl",
      "name": "generateFileSkeleton",
      "match_hash": "a65abeeb6a5fee8bd688898f6f6b24a0aafe8413d470116f79de68debe3c4688",
      "signature": "fn generateFileSkeleton(allocator: std.mem.Allocator, src_path: []const u8, workspace: []const u8, guidance_dir: []const u8) -> ?[]const u8",
      "returns": "?[]const u8",
      "is_pub": true,
      "line": 338
    },
    {
      "type": "fn_decl",
      "name": "generateStructSkeleton",
      "match_hash": "294c57ad4fc878be30bef2905d766f85e4270910603aef211df11aa10cf7840e",
      "signature": "fn generateStructSkeleton(allocator: std.mem.Allocator, struct_name: []const u8, guidance_dir: []const u8) -> ?[]const u8",
      "returns": "?[]const u8",
      "is_pub": true,
      "line": 521
    },
    {
      "type": "fn_private",
      "name": "findAndGenerateStructSkeleton",
      "match_hash": "59c9721b079e97f7137c0988ffce8ef463beddab6a7ba2c2bd54c4ed457b6d41",
      "signature": "fn findAndGenerateStructSkeleton(allocator: std.mem.Allocator, struct_name: []const u8, json_dir: []const u8, rel_path: []const u8) -> ?[]const u8",
      "returns": "?[]const u8",
      "is_pub": false,
      "line": 547
    },
    {
      "type": "fn_private",
      "name": "generateStructSkeletonFromJson",
      "match_hash": "56825bc39af2d139623b06aea1e3c161ee27c9a09f0c26a6461aba037c1b264e",
      "signature": "fn generateStructSkeletonFromJson(allocator: std.mem.Allocator, obj: std.json.ObjectMap, struct_name: []const u8, source_content: ?[]const u8) -> ?[]const u8",
      "returns": "?[]const u8",
      "is_pub": false,
      "line": 607
    },
    {
      "type": "fn_decl",
      "name": "renderCapabilityDocument",
      "match_hash": "05fdc94edf75d031b64433c97285c1db9527237394e3d6955bd3fab4f1380876",
      "signature": "fn renderCapabilityDocument(allocator: std.mem.Allocator, cap_name: []const u8, capabilities_dir: []const u8, llm_client: ?*llm.LlmClient, natural_lang_query: bool) -> error{OutOfMemory}!?[]const u8",
      "returns": "error{OutOfMemory}!?[]const u8",
      "is_pub": true,
      "line": 737
    },
    {
      "type": "fn_private",
      "name": "parseCapabilityDescription",
      "match_hash": "cf525fcbb21b57c3a73ac98f07b05b100aa47d78b137f51bcf7e8830b6e37164",
      "signature": "fn parseCapabilityDescription(allocator: std.mem.Allocator, content: []const u8) -> error{OutOfMemory}!?[]const u8",
      "returns": "error{OutOfMemory}!?[]const u8",
      "is_pub": false,
      "line": 800
    },
    {
      "type": "struct",
      "name": "SkeletonOutputConfig",
      "match_hash": "a3f181805dcad75e1b23b576bcfb034c3522105657dfcbc1a4333caba6967068",
      "signature": "keyword_struct SkeletonOutputConfig { ... }",
      "is_pub": true,
      "line": 817
    },
    {
      "type": "fn_decl",
      "name": "formatSkeletonOutput",
      "match_hash": "6a10e7d501aeccb2668dd7f4915aeee492646f73f8f4976d45221a834a507bb4",
      "signature": "fn formatSkeletonOutput(allocator: std.mem.Allocator, skeleton: []const u8, config: SkeletonOutputConfig) -> []const u8",
      "returns": "[]const u8",
      "is_pub": true,
      "line": 826
    }
  ]
}
