{
  "meta": {
    "module": "src.wasm.execution_request",
    "source": "src/wasm/execution_request.zig",
    "language": "zig"
  },
  "skills": [
    { "ref": "skills/gof-patterns/SKILL.md", "context": "GoF patterns detected" }
  ],
  "used_by": ["src/wasm/wasm.zig"],
  "members": [
    {
      "type": "struct",
      "name": "ExecutionRequestBuilder",
      "match_hash": "0d968c99a01af47350bc500a71744dc2ecad152599fd1303c2dd03a9080480f0",
      "signature": "keyword_struct ExecutionRequestBuilder { ... }",
      "patterns": [
        { "name": "Builder (GoF)", "type": "GoF", "ref": "guidance/skills/gof-patterns/SKILL.md#builder" }
      ],
      "is_pub": true,
      "members": [
        {
          "type": "fn_decl",
          "name": "init",
          "match_hash": "10089975963808a6bc41ef5928eb306107a473d03d0413cbf2f0574b21dc8661",
          "signature": "fn init(allocator: std.mem.Allocator) -> Self",
          "returns": "Self",
          "is_pub": true,
          "line": 43
        },
        {
          "type": "fn_private",
          "name": "hasError",
          "match_hash": "0018fd1f4df5f3fb100897381095796e95ae124751fc9328818535e0e18711b5",
          "signature": "fn hasError(self: *Self) -> bool",
          "returns": "bool",
          "is_pub": false,
          "line": 50
        },
        {
          "type": "fn_private",
          "name": "setError",
          "match_hash": "0f97ab7752e43a3398da294574093888f79ee99140a0e96818fc2fbf43b46475",
          "signature": "fn setError(self: *Self, phase: BuilderPhase, field: []const u8, constraint: []const u8, cause: anyerror) -> void",
          "returns": "void",
          "is_pub": false,
          "line": 54
        },
        {
          "type": "fn_decl",
          "name": "targetId",
          "match_hash": "c804d32aafbc98fe9592011d18300f687a640ca0aa184b62bc8d554b0177b607",
          "signature": "fn targetId(self: *Self, id: i64) -> *Self",
          "returns": "*Self",
          "is_pub": true,
          "line": 67
        },
        {
          "type": "fn_decl",
          "name": "input",
          "match_hash": "72cd592fcbc8adbfc169319bf79d983d0a846bea054732b06fc260a26f581acc",
          "signature": "fn input(self: *Self, bytes: []const u8) -> *Self",
          "returns": "*Self",
          "is_pub": true,
          "line": 78
        },
        {
          "type": "fn_decl",
          "name": "flag",
          "match_hash": "9e91581bb4c5ed000c13cc341efcc5412ce098e71fd7c78e4d52dfce68d8d2ad",
          "signature": "fn flag(self: *Self, f: u32) -> *Self",
          "returns": "*Self",
          "is_pub": true,
          "line": 92
        },
        {
          "type": "fn_decl",
          "name": "providesBitset",
          "match_hash": "0a84a7ab9d9341840382ff09fb3ebcbcf2f7657e2420b7673de8a84286447d47",
          "signature": "fn providesBitset(self: *Self, bs: std.bit_set.DynamicBitSetUnmanaged) -> *Self",
          "returns": "*Self",
          "is_pub": true,
          "line": 99
        },
        {
          "type": "fn_decl",
          "name": "build",
          "match_hash": "22953d58b8b80748e7e9895b703ffaa249f9a1d77bdf35efa554e59e38a53631",
          "signature": "fn build(self: *Self) -> []u8",
          "returns": "[]u8",
          "is_pub": true,
          "line": 109
        }
      ],
      "line": 30
    },
    {
      "type": "struct",
      "name": "WasmExecution",
      "match_hash": "d6923271740a99e04ecc17ba7391a81cfebfa0fdee0173fbb1a5651fe55f5859",
      "signature": "keyword_struct WasmExecution { ... }",
      "is_pub": true,
      "members": [
        {
          "type": "fn_decl",
          "name": "deinit",
          "match_hash": "d50f43ecb862ab0e39d51fe0a742b0ce1d93b3a2bbee5fadfbd0f2d9694614c2",
          "signature": "fn deinit(self: *WasmExecution) -> void",
          "returns": "void",
          "is_pub": true,
          "line": 174
        }
      ],
      "line": 165
    },
    {
      "type": "test_decl",
      "name": "ExecutionRequestBuilder: round-trip target_id and input",
      "is_pub": false,
      "line": 233
    },
    {
      "type": "test_decl",
      "name": "ExecutionRequestBuilder: flag accumulation",
      "is_pub": false,
      "line": 253
    },
    {
      "type": "test_decl",
      "name": "ExecutionRequestBuilder: error on zero target_id",
      "is_pub": false,
      "line": 269
    },
    {
      "type": "test_decl",
      "name": "ExecutionRequestBuilder: error on missing target_id",
      "is_pub": false,
      "line": 274
    },
    {
      "type": "test_decl",
      "name": "ExecutionRequestBuilder: empty input builds valid payload",
      "is_pub": false,
      "line": 279
    }
  ]
}
