{
  "meta": {
    "module": "src.coral.cache_l1",
    "source": "src/coral/cache_l1.zig",
    "language": "zig"
  },
  "comment": " cache_l1.zig — L1/L1Hash Cache Types\n\n L1: Memory Cache (<10ms exact query hash → pre-rendered ContextNodes)\n L1Hash: u64-keyed cache with RwLock for shared reads.",
  "used_by": ["src/coral/cache.zig", "src/coral/cache_reactor.zig"],
  "members": [
    {
      "type": "enum",
      "name": "CacheTier",
      "match_hash": "2ee80326d2e14d4cda90f086ed56116c4e5ae736db1b9b043ef63c404ed5de0e",
      "signature": "keyword_enum CacheTier { ... }",
      "is_pub": true,
      "members": [
        {
          "type": "enum_field",
          "name": "l1_memory",
          "is_pub": false,
          "line": 14
        },
        {
          "type": "enum_field",
          "name": "l2_workflow",
          "is_pub": false,
          "line": 15
        },
        {
          "type": "enum_field",
          "name": "l3_graph",
          "is_pub": false,
          "line": 16
        },
        {
          "type": "enum_field",
          "name": "l4_semantic",
          "is_pub": false,
          "line": 17
        },
        {
          "type": "enum_field",
          "name": "l4_5_decompose",
          "is_pub": false,
          "line": 18
        },
        {
          "type": "enum_field",
          "name": "l5_llm",
          "is_pub": false,
          "line": 19
        }
      ],
      "line": 13
    },
    {
      "type": "struct",
      "name": "RoutingResult",
      "match_hash": "9b535d00a3c6018e6fc792300c3d96697b113c6eeafac16989ab740a843a940a",
      "signature": "keyword_struct RoutingResult { ... }",
      "is_pub": true,
      "line": 22
    },
    {
      "type": "struct",
      "name": "L1Cache",
      "match_hash": "c35eede1265d83dbfaccdee6b264cac4f4bbfee7990f9507cb186022ba27c155",
      "signature": "keyword_struct L1Cache { ... }",
      "is_pub": true,
      "members": [
        {
          "type": "fn_decl",
          "name": "init",
          "match_hash": "d161efc12f626777c75df146d35d142deddd68cf8595587da06a651e37825bcd",
          "signature": "fn init(allocator: std.mem.Allocator) -> L1Cache",
          "returns": "L1Cache",
          "is_pub": true,
          "line": 49
        },
        {
          "type": "fn_decl",
          "name": "initWithCapacity",
          "match_hash": "9b3165715eef1bcc10c50e6e2c7b2a2a473c62d93d6082c4b5ff0e69bcf6f751",
          "signature": "fn initWithCapacity(allocator: std.mem.Allocator, max_entries: usize) -> L1Cache",
          "returns": "L1Cache",
          "is_pub": true,
          "line": 53
        },
        {
          "type": "fn_decl",
          "name": "deinit",
          "match_hash": "7d9add2725c707379131995381e998e654e0a90ed16c88109e3c564de9558efa",
          "signature": "fn deinit(self: *L1Cache) -> void",
          "returns": "void",
          "is_pub": true,
          "line": 61
        },
        {
          "type": "fn_decl",
          "name": "get",
          "match_hash": "a313ff3430185a82b3ce938b7bc5d4a69d3bb15c50e4751844e93f8f3e2575f6",
          "signature": "fn get(self: *L1Cache, query_hash: []const u8) -> ?RoutingResult",
          "returns": "?RoutingResult",
          "is_pub": true,
          "line": 72
        },
        {
          "type": "fn_decl",
          "name": "put",
          "match_hash": "0d4b5bac5ae464e1067a281a8350408abd6446bbe12cf0d55e51c101010feba2",
          "signature": "fn put(self: *L1Cache, query_hash: []const u8, result: RoutingResult) -> void",
          "returns": "void",
          "is_pub": true,
          "line": 82
        },
        {
          "type": "fn_private",
          "name": "freeRoutingResult",
          "match_hash": "10a875513251f07f4fe940502a3381725d4c4d71a007703157f476cc61a89650",
          "signature": "fn freeRoutingResult(allocator: std.mem.Allocator, result: *RoutingResult) -> void",
          "returns": "void",
          "is_pub": false,
          "line": 125
        },
        {
          "type": "fn_private",
          "name": "dupeRoutingResult",
          "match_hash": "ccc4b83b167226d6246d74678b16e33263b4fdc72da841d0a49fc70630c02e16",
          "signature": "fn dupeRoutingResult(allocator: std.mem.Allocator, result: RoutingResult) -> RoutingResult",
          "returns": "RoutingResult",
          "is_pub": false,
          "line": 138
        }
      ],
      "line": 42
    },
    {
      "type": "struct",
      "name": "L1HashCache",
      "match_hash": "ed8965f66cabb1992e8d394db2891cd2c7b4904f4b1db0b91001f214602f4502",
      "signature": "keyword_struct L1HashCache { ... }",
      "is_pub": true,
      "members": [
        {
          "type": "fn_decl",
          "name": "init",
          "match_hash": "f261016aeda7796d581ecc1e9af9373dce7e8edffa59877e95109c1c11da8bd9",
          "signature": "fn init(allocator: std.mem.Allocator, max_entries: usize) -> Self",
          "returns": "Self",
          "is_pub": true,
          "line": 184
        },
        {
          "type": "fn_decl",
          "name": "deinit",
          "match_hash": "be92814edf1a681576bb29a7d2e90d22d27597bd53a72a0fe1a49ee774e80b33",
          "signature": "fn deinit(self: *Self) -> void",
          "returns": "void",
          "is_pub": true,
          "line": 192
        },
        {
          "type": "fn_decl",
          "name": "get",
          "match_hash": "4a53c721478fab4517faa33f4eb3c9a9a77989f66c39da8a8ba6748197a4563b",
          "signature": "fn get(self: *Self, query_hash: u64) -> ?RoutingResult",
          "returns": "?RoutingResult",
          "is_pub": true,
          "line": 202
        },
        {
          "type": "fn_decl",
          "name": "getWithPromotion",
          "match_hash": "7a48ac92a855b5decf6db4d361d7a671409c0418ad42777ffdc7985e0cdecef1",
          "signature": "fn getWithPromotion(self: *Self, query_hash: u64) -> ?RoutingResult",
          "returns": "?RoutingResult",
          "is_pub": true,
          "line": 210
        },
        {
          "type": "fn_decl",
          "name": "put",
          "match_hash": "41bf4138026fa07d8f6f8fdd6b63e2b40a2cb3de7c0af9bbfab5e2cdfd026172",
          "signature": "fn put(self: *Self, query_hash: u64, result: RoutingResult) -> void",
          "returns": "void",
          "is_pub": true,
          "line": 220
        },
        {
          "type": "fn_decl",
          "name": "hashQuery",
          "match_hash": "c75e97960c1d969769fbac23d16473cddc215976ca1fa14bd450de27a5eeab01",
          "signature": "fn hashQuery(query: []const u8) -> u64",
          "returns": "u64",
          "is_pub": true,
          "line": 257
        }
      ],
      "line": 175
    }
  ]
}
