{
  "meta": {
    "module": "src.guidance.health.orphan",
    "source": "src/guidance/health/orphan.zig",
    "language": "zig"
  },
  "comment": " orphan.zig — Phase 0: Orphaned source file detection for `guidance codehealth`.\n\n An \"orphaned\" file is a .zig source file that:\n   - Is not imported by any other file via @import\n   - Is not a recognised entry point\n\n Entry points (always excluded from orphan detection):\n   - Files containing `pub fn main` (CLI executables)\n   - Files referenced as root_source_file in build.zig\n   - Test files: names matching `*_test.zig` or `*_tests.zig`\n   - Files containing the comment `// CODEHEALTH: entry-point`",
  "used_by": ["src/guidance/health/health.zig", "src/guidance/health/orphan_tests.zig"],
  "members": [
    {
      "type": "fn_decl",
      "name": "extractBuildZigRoots",
      "match_hash": "71f50ab367fafb14bae625cc97fa6a5cccbbacbb83689a696bc47b93fade4cb3",
      "signature": "fn extractBuildZigRoots(allocator: std.mem.Allocator, build_zig_src: []const u8) -> [][]const u8",
      "params": [
        { "name": "allocator", "type": "std.mem.Allocator" },
        { "name": "build_zig_src", "type": "[]const u8" }
      ],
      "returns": "[][]const u8",
      "is_pub": true,
      "line": 45
    },
    {
      "type": "fn_decl",
      "name": "extractImportPaths",
      "match_hash": "fa91a266143c460715375f7d56edbc7eba63ca285b0da7530f980b41b12018e4",
      "signature": "fn extractImportPaths(allocator: std.mem.Allocator, source: [:0]const u8) -> [][]const u8",
      "params": [
        { "name": "allocator", "type": "std.mem.Allocator" },
        { "name": "source", "type": "[:0]const u8" }
      ],
      "returns": "[][]const u8",
      "is_pub": true,
      "line": 79
    },
    {
      "type": "fn_decl",
      "name": "hasPubFnMain",
      "match_hash": "6595c53fff079e98da4a60efd151ca5bf131278099cd0c12f68b0cd00b15d9e0",
      "signature": "fn hasPubFnMain(source: []const u8) -> bool",
      "params": [
        { "name": "source", "type": "[]const u8" }
      ],
      "returns": "bool",
      "is_pub": true,
      "line": 139
    },
    {
      "type": "fn_decl",
      "name": "hasEntryPointMarker",
      "match_hash": "2edd30b47aed77540ff81de471cc635ed20989f470c6bfe07fb1cd1437ddb5ab",
      "signature": "fn hasEntryPointMarker(source: []const u8) -> bool",
      "params": [
        { "name": "source", "type": "[]const u8" }
      ],
      "returns": "bool",
      "is_pub": true,
      "line": 144
    },
    {
      "type": "fn_decl",
      "name": "isTestFileName",
      "match_hash": "de987c514081d456382f7ca41f5ffa8486176fce24bcd98c437ed4d668cb16ec",
      "signature": "fn isTestFileName(basename: []const u8) -> bool",
      "params": [
        { "name": "basename", "type": "[]const u8" }
      ],
      "returns": "bool",
      "is_pub": true,
      "line": 150
    },
    {
      "type": "fn_decl",
      "name": "findOrphanedFiles",
      "match_hash": "87b353ef41f2628ae1043980613f22c0bd8a70711bb95421db2f93213f77aaf3",
      "signature": "fn findOrphanedFiles(allocator: std.mem.Allocator, workspace: []const u8) -> []OrphanedFile",
      "params": [
        { "name": "allocator", "type": "std.mem.Allocator" },
        { "name": "workspace", "type": "[]const u8" }
      ],
      "returns": "[]OrphanedFile",
      "is_pub": true,
      "line": 173
    },
    {
      "type": "fn_private",
      "name": "resolveImportPath",
      "match_hash": "e003d2b51571035340a3b111550686547fd015d614913e01438936b2ab50d95e",
      "signature": "fn resolveImportPath(allocator: std.mem.Allocator, workspace: []const u8, file_dir: []const u8, import_path: []const u8) -> []const u8",
      "params": [
        { "name": "allocator", "type": "std.mem.Allocator" },
        { "name": "workspace", "type": "[]const u8" },
        { "name": "file_dir", "type": "[]const u8" },
        { "name": "import_path", "type": "[]const u8" }
      ],
      "returns": "[]const u8",
      "is_pub": false,
      "line": 299
    }
  ]
}
