{
  "meta": {
    "module": "src.guidance.query.identifier",
    "source": "src/guidance/query/identifier.zig",
    "language": "zig"
  },
  "comment": " identifier_match.zig — Identifier pattern detection for TIER 0/1 query routing.\n\n Detects whether a query string is an exact identifier (function, struct, method,\n file, or module name) rather than natural language.  Identifier queries route to\n TIER 0 or TIER 1 — deterministic DB lookups — bypassing LLM synthesis entirely.\n\n Detection rules (in priority order):\n 1. Empty / whitespace-only → not an identifier.\n 2. Contains spaces → not an identifier (identifiers are single tokens).\n 3. File-path heuristic: contains '/' → .file kind.\n 4. Dotted path: `module.Member` → .method or .struct based on member case.\n    Three-segment: `a.b.c` → outer is module, inner is struct, last is method.\n 5. Single PascalCase word → .struct (or generic type).\n 6. Single snake_case / camelCase word → .function.\n\n §Performance: pure string scanning, no allocations, <1 µs.",
  "used_by": ["src/guidance/query/strategy.zig"],
  "members": [
    {
      "type": "enum",
      "name": "IdentifierKind",
      "match_hash": "1db4a3b68cfbce4a6485a7c76bb0db3350217c8e45078088e9651bf83b7cfd23",
      "signature": "keyword_enum IdentifierKind { ... }",
      "is_pub": true,
      "members": [
        {
          "type": "enum_field",
          "name": "function",
          "is_pub": false,
          "line": 21
        },
        {
          "type": "enum_field",
          "name": "method",
          "is_pub": false,
          "line": 22
        },
        {
          "type": "enum_field",
          "name": "@\"struct\"",
          "is_pub": false,
          "line": 24
        },
        {
          "type": "enum_field",
          "name": "file",
          "is_pub": false,
          "line": 25
        },
        {
          "type": "enum_field",
          "name": "module",
          "is_pub": false,
          "line": 26
        }
      ],
      "line": 20
    },
    {
      "type": "struct",
      "name": "IdentifierMatch",
      "match_hash": "a1d8c39ce2971104a13c321ca6f37599bd63675b70f0618d6b2e9f92071f8250",
      "signature": "keyword_struct IdentifierMatch { ... }",
      "is_pub": true,
      "line": 29
    },
    {
      "type": "fn_decl",
      "name": "detectIdentifierPattern",
      "match_hash": "40e0bf54bc1f634d894e59700e69c680ab9f6d1e09d3ba1097e05ca57f8c21a1",
      "signature": "fn detectIdentifierPattern(query: []const u8) -> ?IdentifierMatch",
      "returns": "?IdentifierMatch",
      "is_pub": true,
      "line": 40
    },
    {
      "type": "fn_decl",
      "name": "isPascalCase",
      "match_hash": "39a4cd4670ca38972c72a8b63efb4c775dcafaa3ff27c818fe51b9320f5a6d69",
      "signature": "fn isPascalCase(s: []const u8) -> bool",
      "returns": "bool",
      "is_pub": true,
      "line": 93
    },
    {
      "type": "fn_decl",
      "name": "shouldSkipLLMSynthesis",
      "match_hash": "5e585eeb737a39c1e1ff8d0ea56ebb1c164f3455c52dff3c3d641cf3de386b76",
      "signature": "fn shouldSkipLLMSynthesis(query: []const u8, exact_match: bool) -> bool",
      "returns": "bool",
      "is_pub": true,
      "line": 98
    },
    {
      "type": "test_decl",
      "name": "isPascalCase: true for uppercase first char",
      "is_pub": false,
      "line": 119
    },
    {
      "type": "test_decl",
      "name": "isPascalCase: false for lowercase or empty",
      "is_pub": false,
      "line": 126
    },
    {
      "type": "test_decl",
      "name": "detectIdentifierPattern: null for natural language",
      "is_pub": false,
      "line": 133
    },
    {
      "type": "test_decl",
      "name": "detectIdentifierPattern: single snake_case function",
      "is_pub": false,
      "line": 140
    },
    {
      "type": "test_decl",
      "name": "detectIdentifierPattern: single PascalCase struct",
      "is_pub": false,
      "line": 147
    },
    {
      "type": "test_decl",
      "name": "detectIdentifierPattern: module.struct two-segment",
      "is_pub": false,
      "line": 154
    },
    {
      "type": "test_decl",
      "name": "detectIdentifierPattern: module.function two-segment",
      "is_pub": false,
      "line": 161
    },
    {
      "type": "test_decl",
      "name": "detectIdentifierPattern: three-segment method",
      "is_pub": false,
      "line": 168
    },
    {
      "type": "test_decl",
      "name": "detectIdentifierPattern: file path",
      "is_pub": false,
      "line": 174
    },
    {
      "type": "test_decl",
      "name": "shouldSkipLLMSynthesis: empty query",
      "is_pub": false,
      "line": 181
    },
    {
      "type": "test_decl",
      "name": "shouldSkipLLMSynthesis: exact match bypasses LLM",
      "is_pub": false,
      "line": 186
    },
    {
      "type": "test_decl",
      "name": "shouldSkipLLMSynthesis: identifier bypasses LLM",
      "is_pub": false,
      "line": 190
    },
    {
      "type": "test_decl",
      "name": "shouldSkipLLMSynthesis: natural language does not bypass",
      "is_pub": false,
      "line": 196
    }
  ]
}
